	group	unnamed: 1	questions	answer
64	q33	slovem	(R). tm. symboly ((C) | tm). (nutnost | povinnost) uvadeni symbolu ((C) | tm). je povinne uvadeni symbolu ((C) | tm). musim uvadet ((C) | tm)? musim uvadet symbol ((C) | tm). co znamena (symbol | znak) ((C) | tm). 	"vlastnik ochranne znamky je opravnen pouzivat spolu s ochrannou znamkou symbol (R). zalezi tedy na vas, zda u sve zapsane ochranne znamky tento symbol budete uvadet. rovnez u ochranne znamky evropske unie muze byt jako doklad o jejim zapisu uveden symbol (R) spolecne s jejim cislem. uzivani a umisteni (R) zakon nijak neupravuje. pouziti u ochranne znamky, ktera jeste neni zapsana do rejstriku, vsak muze byt posuzovano jako klamava reklama apod. v nekterych zemich se dokonce muze jednat o trestny cin.

tm ((TM)) je jina jazykova varianta symbolu (R) pro zapsanou ochrannou znamku. uziva se v ruznych castech sveta, u nas neni obvykla.
symbol (C) je svazan s autorskym pravem (copyright). problematiku autorskeho prava ma ve sve gesci ministerstvo kultury.

vice na https://upv.gov.cz/o-uradu/nejcastejsi-dotazy-faq-."
65		hlasem	(R). tm. symboly ((C) | tm). (nutnost | povinnost) uvadeni symbolu ((C) | tm). je povinne uvadeni symbolu ((C) | tm). musim uvadet ((C) | tm)? musim uvadet symbol ((C) | tm). co znamena (symbol | znak) ((C) | tm). rekni mi co je ((R) | tm). rekni mi jeslti je ((R) | tm) povinny.	
66	q34	slovem	ocenovani (prumyslovych prav | patentu | vynalezu | uzitnych vzoru | prumyslovych vzoru | ochrannych znamek). jak se provadi ocenovani (prumyslovych prav | patentu | vynalezu | uzitnych vzoru | prumyslovych vzoru | ochrannych znamek)? jaky je postup pri ocenovani (prumyslovych prav | patentu | vynalezu | uzitnych vzoru | prumyslovych vzoru | ochrannych znamek)? kdo provadi ocenovani (prumyslovych prav | patentu | vynalezu | uzitnych vzoru | prumyslovych vzoru | ochrannych znamek)? co je ocenovani (prumyslovych prav | patentu | vynalezu | uzitnych vzoru | prumyslovych vzoru | ochrannych znamek).	"ocenovani prumyslovych prav nespada do kompetence uradu prumysloveho vlastnictvi. tuto cinnost provadeji soudni znalci z oboru prumyslovych prav. rejstrik soudnich znalcu vede kazdy soud, informace lze rovnez ziskat na internetovych strankach ministerstva spravedlnosti cr pod heslem evidence znalcu, tlumocniku a znaleckych ustavu. zde je mozno vyhledat konkretniho znalce z pozadovane zemepisne oblasti cr.

vice na https://upv.gov.cz/o-uradu/nejcastejsi-dotazy-faq-. ministerstvo spravedlnosti zde: https://www.justice.cz/"
67		hlasem	ocenovani (prumyslovych prav | patentu | vynalezu | uzitnych vzoru | prumyslovych vzoru | ochrannych znamek). jak se provadi ocenovani (prumyslovych prav | patentu | vynalezu | uzitnych vzoru | prumyslovych vzoru | ochrannych znamek)? jaky je postup pri ocenovani (prumyslovych prav | patentu | vynalezu | uzitnych vzoru | prumyslovych vzoru | ochrannych znamek)? kdo provadi ocenovani (prumyslovych prav | patentu | vynalezu | uzitnych vzoru | prumyslovych vzoru | ochrannych znamek)? co je ocenovani (prumyslovych prav | patentu | vynalezu | uzitnych vzoru | prumyslovych vzoru | ochrannych znamek). rekni mi jak ocenim (prumyslove pravo | patent | vynalez | uzitny vzor | prumyslovy vzor | ochrannou znamku). rekni mi na koho se obratim pri ocenovani (prumyslovych prav | patentu | vynalezu | uzitnych vzoru | prumyslovych vzoru | ochrannych znamek).	
68	q35	slovem	jak urad podava informaci o zahajeni rizeni o zapisu prevodu (ochranne znamky | patentu | prumysloveho vzoru | uzitneho vzoru)? jak ziskam informaci o zapisu prevodu (ochranne znamky | patentu | prumysloveho vzoru | uzitneho vzoru)? jakym zpusobem ziskam informaci o zapisu prevodu (ochranne znamky | patentu | prumysloveho vzoru | uzitneho vzoru).	"po prijeti zadosti o zapis prevodu urad bez zbytecneho odkladu uvedomi smluvni strany prevodu o zahajeni rizeni o zapisu prevodu. pote urad vycka primerenou dobu (obvykle 1 mesic) a kdyz neobdrzi relevantni vytku tykajici se prevodu (zejmena od druhe smluvni strany prevodu, ktera neiniciovala rizeni)  je prevod zaregistrovan.

krome splneni zakonne povinnosti pristoupil urad k teto praxi tez s ohledem na upevneni pravni jistoty obou zucastnenych stran prevodu. duvodem byla tez snaha zamezit spekulativnim prevodum a chranit tak opravnene zajmy vlastniku prumyslovych prav.

vice na https://upv.gov.cz/o-uradu/nejcastejsi-dotazy-faq-"
69		hlasem	jak urad podava informaci o zahajeni rizeni o zapisu prevodu (ochranne znamky | patentu | prumysloveho vzoru | uzitneho vzoru)? jak ziskam informaci o zapisu prevodu (ochranne znamky | patentu | prumysloveho vzoru | uzitneho vzoru)? jakym zpusobem ziskam informaci o zapisu prevodu (ochranne znamky | patentu | prumysloveho vzoru | uzitneho vzoru). rekni mi jak ziskam informaci o zahajeni rizeni o zapisu prevodu (ochranne znamky | patentu | prumysloveho vzoru | uzitneho vzoru)?	
70	q36	slovem	zadost o zapis (prevodu | licence | zastavy). jakou formu maji mit (doklady | dokumenty) k zadostem o zapis (prevodu | licence | zastavy)? jak maji vypadat (doklady | dokumenty) k  zadostem o zapis (prevodu | licence | zastavy)	"k zadostem o zapis prevodu, licence ci zastavy se prikladaji prevodni smlouva, licencni smlouva ci zastavni smlouva, pripadne plna moc. pouze u ochrannych znamek je misto prevodni smlouvy mozno prilozit formular potvrzeni o prevodu. doklady se predkladaji i pri pisemnem podani v jednom vyhotoveni a to v originalu ci v overene kopii. podpisy na dokladech nemusi byt overeny. 

pokud je zadost podana elektronicky se zarucenym elektronickym podpisem nebo prostrednictvim datove schranky a k teto zadosti je pripojena prevodni, licencni ci zastavni smlouva, pripadne plna moc, musi byt u prilozeneho dokladu provedena autorizovana konverze do elektronicke podoby. potom ma tento dokument stejne pravni ucinky jako puvodni konvertovany dokument a neni treba zasilat uradu jeste jeho pisemny original ci overenou kopii. pokud neni autorizovana konverze do elektronicke podoby provedena, je doklad povazovan za kopii a podatel zadosti je povinen dodat uradu jeste original ci overenou kopii tohoto dokladu v papirove podobe.

pokud evropsky patentovy urad provede u evropskeho patentu v evropskem patentovem rejstriku pro ucely dalsiho rizeni pred evropskym patentovym uradem (podani odporu) zapis noveho nebo zmeneneho udaje (napriklad zmenu, prevod, prechod, licenci, zastavni pravo apod.) s ucinnosti po datu oznameni o udeleni evropskeho patentu v evropskem patentovem vestniku, tento zapis se provede v ceskem rejstriku evropskych patentu teprve na zaklade projevu vule (zadosti) opravnene osoby. 

na zadost se pohlizi obdobne, jako na zadost podanou k narodnim patentum. v pripade, ze je zadost zpoplatnena dle zakona o spravnich poplatcich, vyzaduje se k provedeni zapisu do rejstriku uhrada spravniho poplatku. k provedeni tohoto zapisu do rejstriku urad pozaduje projev vule (zadost) opravnene osoby dolozeny fotokopii sdeleni evropskeho patentoveho uradu o registraci zmeny (epo form 2544) - v tomto pripade tedy neni vyzadovan original smlouvy.

vice na https://upv.gov.cz/o-uradu/nejcastejsi-dotazy-faq-. formulare zde: https://upv.gov.cz/prumyslova-prava/formulare"
71		hlasem	zadost o zapis (prevodu | licence | zastavy). jakou formu maji mit (doklady | dokumenty) k zadostem o zapis (prevodu | licence | zastavy)? jak maji vypadat (doklady | dokumenty) k  zadostem o zapis (prevodu | licence | zastavy). rekni mi jak vypadaji (doklady | dokumenty) k zadostem o zapis (prevodu | licence | zastavy)?	
72	q37	slovem	prezidialni plna moc. co je to prezidialni plna moc. jakym zpusobem je prezidialni plna moc evidovana u uradu? jake jsou nalezitosti prezidialni plne moci?	"prezidialni plna moc je druh plne moci, kterou udeluje zmocnitel zastupci pro veskera rizeni pred uradem. v teto plne moci nejsou tedy specifikovana ani konkretni prumyslova prava ani konkretni ukony, ke kterym je zastupce zmocnen. prezidialni plna moc je predkladana v originale ci v overene kopii. podpisy nemusi byt overeny. nezbytnymi nalezitostmi jsou:

    identifikace zmocnitele,
    identifikace zmocnence,
    zmocneni,
    datum a podpis. 

vice na https://upv.gov.cz/o-uradu/nejcastejsi-dotazy-faq-"
73		hlasem	prezidialni plna moc. co je to prezidialni plna moc. jakym zpusobem je prezidialni plna moc evidovana u uradu? jake jsou nalezitosti prezidialni plne moci? rekni mi co je prezidialni plna moc. rekni mi jake jsou nalezitosti prezidialni plne moci.	
74	q38	slovem	nahlizeni do spravniho spisu. za jakych podminek lze nahlizet do spravniho spisu? jake jsou podminky nahlizeni do spravniho spisu. muzu nahlizet do spravniho spisu? 	"ucastnici rizeni maji pravo nahlizet do prislusneho spravniho spisu a porizovat si vlastnimi prostredky nebo prostredky uradu (na vlastni naklady) fotokopie casti tohoto spisu. treti strane lze povolit nahlizeni do spisu nebo jeho casti pouze tehdy, pokud v zadosti o nahlizeni do spisu prokaze pravni zajem, napriklad fotokopii dokumentu, od ktereho pravni zajem odvozuje (zaloba, soudni spor a tak dale). 

pravnim nebo vaznym duvodem pro nahlednuti do spisu muze byt vedecka ci pedagogicka cinnost, v souvislosti s niz je treba do spravniho spisu nahlednout, souvisejici soudni ci spravni rizeni nebo pravni nastupnictvi nektereho z ucastniku rizeni. zadatel, pripadne i jeho zmocnenec, musi byt v zadosti identifikovan. nahlizeni vyrizuje odpovedny pracovnik utvaru uradu, kde se spis nachazi. 

v zadosti je vhodne uvest telefonni nebo emailovy kontakt na zadatele, na kterem je mozno vyjasnit pripadne vady zadosti a sjednat termin. doporucujeme termin nahlizeni sjednat nejlepe tyden predem, aby se zabranilo casovym ztratam nahlizejiciho spojenym s transportem a pripravou spisu k nahlizeni. pred nahlizenim do spisu je treba, aby nahlizejici jednoznacne prokazal svoji totoznost, pripadne tez zmocneni k nahlizeni (napriklad plnou moci). o nahlizeni se sepise protokol.

pripadnou konzultaci s prislusnym referentem je nutno pojimat separatne od nahlizeni do spravniho spisu. o tomto jednani je nutno sepsat protokol o jednani.

vice na https://upv.gov.cz/o-uradu/nejcastejsi-dotazy-faq-"
75		hlasem		
76	q39	slovem	obnova. prodlouzeni platnosti. udrzovaci poplatky. jak pozadat o obnovu nebo prodlouzeni platnosti u (ochrannych znamek | uzitnych vzoru | prumyslovych vzoru)? jak postupovat pri placeni udrzovacich poplatku u patentu?  	"poplatky za udrzovani patentu a evropskych patentu se plati bez podani zadosti, pouze uhrazenim techto poplatku s uvedenim variabilniho symbolu (cislo patentu).

udrzovaci poplatky nelze platit kolkovymi znamkami. platcem je majitel patentu nebo jeho zastupce. tyto poplatky se plati rocne, po celou dobu platnosti patentu.

u ochrannych znamek, prumyslovych a uzitnych vzoru je treba krome uhrazeni spravniho poplatku jeste ve stanovene lhute podat zadost o obnovu (prodlouzeni platnosti). zadost muze podat pouze majitel, vlastnik nebo jeho zastupce. 

cizi statni prislusnik musi byt pro podani zadosti zastoupen, pokud v prubehu rizeni nebylo shledano, ze se jedna o osobu, ktera nemusi byt pro jednani pred uradem zastupovana (osoba zijici na uzemi evropske unie, majici sidlo podnikani, organizacni slozku nebo bydliste na uzemi ceske republiky).  

postup k uvedeni variabilniho cisla zde: https://upv.gov.cz/prumyslova-prava/poplatky/uvadeni-variabilnich-symbolu. vice na https://upv.gov.cz/o-uradu/nejcastejsi-dotazy-faq-"
77		hlasem	obnova. prodlouzeni platnosti. udrzovaci poplatky. jak pozadat o obnovu nebo prodlouzeni platnosti u (ochrannych znamek | uzitnych vzoru | prumyslovych vzoru)? obnova. prodlouzeni platnosti. udrzovaci poplatky. jak pozadat o obnovu nebo prodlouzeni platnosti u (ochrannych znamek | uzitnych vzoru | prumyslovych vzoru)? jak postupovat pri placeni udrzovacich poplatku u patentu?  	
78	q40	slovem	vypis z rejstriku. kdo muze pozadat o vypis z rejstriku? kdo si muze zazadat o vypis z rejstriku?	"o vypis z rejstriku muze zazadat kdokoliv, neni treba prokazovat pravni zajem na veci. v zadosti je treba uvest konkretni cislo prihlasky, zapisu nebo patentu. vypis obsahuje aktualni udaje vedene v rejstriku k datu vydani vypisu. u ochrannych znamek je mozno krome aktualniho vypisu vydat i vypis uplny, kde jsou uvedeny i historicke udaje, vedene v rejstriku od zapisu az do soucasnosti. 

spravni poplatek cini 100 kc za kazdou stranku. informace o poctu stran je mozno ziskat na oddeleni rejstriku. pocet stran vypisu z rejstriku ochrannych znamek je mozno zjistit take v detailu konkretniho spisu v on-line internetove databazi uradu.

urad vydava pouze vypisy z rejstriku jim vedenych. o vypisy z rejstriku vedenych mezinarodnimi urady je treba zadat u techto uradu.

databaze zde: https://isdv.upv.cz/webapp/!resdb.oza.frm. vice na https://upv.gov.cz/o-uradu/nejcastejsi-dotazy-faq-"
79		hlasem	vypis z rejstriku. kdo muze pozadat o vypis z rejstriku? kdo si muze zazadat o vypis z rejstriku? rekni mi, kdo muze pozadat o vypis z rejstriku.	
80	q41	slovem	opis. opis listiny. komu muze byt vydan opis listiny vydane uradem? muzu pozadat o opis listiny? jak pozadat o opis listiny	"opis listiny, napriklad osvedceni o zapisu nebo opis patentove listiny, lze vydat na pisemnou zadost majitele, vlastnika nebo jeho zastupce. opis obsahuje pouze ty udaje, ktere obsahovala puvodne vydana listina. spravni poplatek cini 15 kc za stranku.

vice na https://upv.gov.cz/o-uradu/nejcastejsi-dotazy-faq-
"
81		hlasem	opis. opis listiny. komu muze byt vydan opis listiny vydane uradem? muzu pozadat o opis listiny? jak pozadat o opis listiny. rekni mi jak pozadat o opis listiny. 	
82	q42	slovem	doklad o zaplaceni. jak ziskat doklad do ucetnictvi o zaplaceni za prihlasku vynalezu nebo za uhrazeni udrzovacich poplatku? (kde | jak) ziskam doklad o zaplaceni. 	"urad nevydava zadne faktury, ani potvrzeni o platbe spravnich poplatku. spravni poplatky se plati podle zakona o spravnich poplatcich, ve zneni platnych predpisu. 

vzhledem k tomu, ze vyse spravnich poplatku je pevne zakonem stanovena, pro ucely ucetnictvi je dostacujici odkaz na tento zakon a polozku sazebniku spravnich poplatku, ktery je soucasti tohoto zakona. k teto informaci prilozite vas doklad o uhrade spravniho poplatku, napriklad vypis z uctu.

vice na https://upv.gov.cz/o-uradu/nejcastejsi-dotazy-faq-"
83		hlasem	doklad o zaplaceni. jak ziskat doklad do ucetnictvi o zaplaceni za prihlasku vynalezu nebo za uhrazeni udrzovacich poplatku? (kde | jak) ziskam doklad o zaplaceni. rekni mi jak ziskam doklad (o zaplaceni | do ucetnictvi). rekni mi kdo mi vyda doklad (o zaplaceni | do ucetnictvi).	
84	q43	slovem	jaka je platnost ochranne znamky? zajima me platnost ochranne znamky. 	"ochranna znamka po zapisu plati deset let ode dne podani prihlasky. zapis ochranne znamky se na zadost vlastnika ochranne znamky obnovi, a to vzdy na dalsich 10 let. zadost o obnovu zapisu ochranne znamky se podava nejdrive 12 mesicu pred skoncenim doby platnosti a nejpozdeji v dodatecne lhute 6 mesicu po uplynuti doby platnosti znamky.

vice na https://upv.gov.cz/prumyslova-prava/ochranne-znamky"
85		hlasem	jaka je platnost ochranne znamky? zajima me platnost ochranne znamky. rekni mi jaka je platnost ochranne znamky?	
86	q44	slovem	muze prihlasku ochranne znamky podat fyzicka osoba? je mozne podat prihlasku ochranne znamky jako fyzicka osoba?	"prihlasku ochranne znamky k zapisu do rejstriku muze podat jak fyzicka, tak i pravnicka osoba. 
vice na https://upv.gov.cz/prumyslova-prava/ochranne-znamky/narodni-prihlaska-ochranne-znamky"
87		hlasem	muze prihlasku ochranne znamky podat fyzicka osoba? je mozne podat prihlasku ochranne znamky jako fyzicka osoba? rekni mi jestli fyzicka osoba muze podat prihlasku ochranne znamky?	
88	q45	slovem	vymaz ochranne znamky vlastnikem. jaky je postup pri vymazu ochranne znamky z rejstriku jejim vlastnikem. jak postupovat pri vymazu ochranne znamky z rejstriku jejim vlastnikem? 	"dle zakona o ochrannych znamkach se vlastnik muze u uradu svym prohlasenim vzdat prav k ochranne znamce v rozsahu vsech vyrobku ci sluzeb, pro ktere byla zapsana, nebo nekterych z nich. ucinky tohoto prohlaseni nastavaji dnem doruceni prohlaseni vlastnika ochranne znamky uradu a nelze je vzit zpet. urad vyznaci vzdani se prav k ochranne znamce v rejstriku a oznami je ve vestniku. vlastnik muze rovnez zaslat jen sve prohlaseni i bez vyuziti formulare, pouze dopisem.

pro zaslani prohlaseni o vzdani se prav lze pouzit formular obecne sdeleni/zadost nezpoplatnena. formular zde: https://upv.gov.cz/prumyslova-prava/formulare/elektronicky-vyplnitelne-formulare-bez-moznosti-on-line-podani-
"
89		hlasem	vymaz ochranne znamky vlastnikem. jaky je postup pri vymazu ochranne znamky z rejstriku jejim vlastnikem. jak postupovat pri vymazu ochranne znamky z rejstriku jejim vlastnikem? rekni mi jak postupovat pri vymazu ochranne znamky z rejstriku jejim vlastnikem?	
90	q46	slovem	zmena zneni nebo vzhledu zapsane ochranne znamky. je mozna zmena zneni nebo vzhledu zapsane ochranne znamky? 	"
zmena zneni nebo vzhledu zapsane ochranne znamky neni mozna. jedinou moznosti je podani nove prihlasky ochranne znamky. registrace pak bude zaviset na vysledku samotneho zapisneho rizeni, stejne jako u znamky  predchozi.

formular zde: http://www.upv.cz/cs/sluzby-uradu/formulare.html"
91		hlasem	zmena zneni nebo vzhledu zapsane ochranne znamky. je mozna zmena zneni nebo vzhledu zapsane ochranne znamky? rekni mi jeslti je mozna zmena vzhledu zapsane ochranne znamky.	
92	q47	slovem	zmena vlastnika ochranne znamky. jak zmenit vlastnika ochranne znamky? jakym zpusobem zmenit vlastnika ochranne znamky.	"pro vsechny zmeny (prevod, prechod, zmenu v udajich) je treba pouzit formular s nazvem zadost o prevod - zadost o zmenu.
k zadosti o zapis prevodu se priklada smlouva o prevodu prav. v pripade, ze nebudete jako prilohu prikladat smlouvu o prevodu, lze tuto nahradit vyplnenim a dodanim podepsaneho formulare potvrzeni o prevodu ochranne znamky.
 
v hlavicce tohoto formulare vyplnujete cislo spisu a cislo zapisu ochranne znamky, urad vyplni po obdrzeni pouze datum podani.

formulare zde: https://upv.gov.cz/files/uploads/pdf_dokumenty/forms2022v/z01_prevod_zmena_v_o.pdf, https://upv.gov.cz/files/uploads/pdf_dokumenty/forms2022v/z0p1_potvrzeni_o_prevodu_o.pdf.
"
93		hlasem	zmena vlastnika ochranne znamky. jak zmenit vlastnika ochranne znamky? jakym zpusobem zmenit vlastnika ochranne znamky. rekni mi jak zmenim vlastnika ochranne znamky. 	
94	q48	slovem	(web | webova stranka) jako ochranna znamka. je mozne nazev (webu | webovych stranek) ochranit jako ochrannou znamku? muzu zaregistrovat nazev (webu | webovych stranek) jako ochrannou znamku?	"nazev vasich webovych stranek lze ochranit jako ochrannou znamku. ochrannou znamkou muze byt oznaceni vyhovujici podminkam stanovenych zakonem o ochrannych znamkach v jeho platnem zneni. vsechny potrebne informace o prihlasovani ochrannych znamek naleznete na tomto odkazu: http://upv.cz/cs/prumyslova-prava/ochranne-znamky.html
"
95		hlasem	(web | webova stranka) jako ochranna znamka. je mozne nazev (webu | webovych stranek) ochranit jako ochrannou znamku? muzu zaregistrovat nazev (webu | webovych stranek) jako ochrannou znamku? rekni mi jeslti muzu nazev (webu | webove stranky) zaregistrovat jako ochrannoz znamku? 	
96	q49	slovem	doba rizeni narodni prihlasky ochranne znamky. v jakem casovem horizontu po registraci ochranne znamky dojde k jejim zapisu do registru. za jak dlouho bude narodni ochranna znamka zaregistrovana?	"doba rizeni narodni prihlasky ochranne znamky je v prumeru 6 az 9 mesicu od podani prihlasky a zavisi na tom, kdy je uhrazen spravni poplatek a zda je prihlaska po formalni strance (ma veskere nalezitosti, spravne zatrideny seznam vyrobku a sluzeb, apod.) a po vecne strance v poradku (zda splnuje podminky zapisu dle zakona o ochrannych znamkach).

uvedena doba rizeni zahrnuje i zakonnou trimesicni lhutu na zverejneni prihlasky pro ucely podani namitek ze strany tretich osob. pokud nejsou zadne namitky do spisu doruceny, pak se po uplynuti stanovene lhuty zapise oznaceni do rejstriku uradu. osvedceni o registraci ochranne znamky urad zasila vlastnikovi nebo jeho zastupci.

stav a postup rizeni je mozne sledovat po zadani cisla prihlasky v databazi ochrannych znamek. databaze zde: https://isdv.upv.cz/webapp/!resdb.oza.frm 
"
97		hlasem	doba rizeni narodni prihlasky ochranne znamky. v jakem casovem horizontu po registraci ochranne znamky dojde k jejim zapisu do registru. za jak dlouho bude narodni ochranna znamka zaregistrovana? rekni mi jak dlouho trva, nez je narodni ochranna znamka zaregistrovana?	
98	q50	slovem	uplynuti doby platnosti zapisu ochranne znamky. upozornuje urad na uplynuti doby platnosti zapisu ochranne znamky?	"dle zakona o ochrannych znamkachma urad prumysloveho vlastnictvi obligatorni povinnost informovat vlastnika ochranne znamky o dni uplynuti doby platnosti zapisu, a to nejpozdeji do 6 mesicu pred timto dnem. urad zasila upozorneni generovane automatickym systemem vypocetni techniky uradu a to emailem, datovou schrankou, nebo postou.
"
99		hlasem	uplynuti doby platnosti zapisu ochranne znamky. upozornuje urad na uplynuti doby platnosti zapisu ochranne znamky? rekni mi jeslti urad upozornuje na uplynuti doby platnosti zapisu ochranne znamky. 	
